{
  "schema_version": "0.1.0",
  "run_id": "hcx_structured_protocol_8b534e15db924e5691d2a02d4c62473c",
  "created_at": "2026-09-02T00:13:28.146Z",
  "ready": true,
  "stopped_early_reason": null,
  "total_requests_attempted": 30,
  "candidates": {
    "FUNCTION_CALLING": {
      "candidate_id": "FUNCTION_CALLING",
      "construction_error": null,
      "requests_attempted": 15,
      "requests_succeeded": 15,
      "requests_failed": 0,
      "retries_performed": 0,
      "per_scenario": [
        {
          "scenario_type": "SHORT_KOREAN_FACT_SUMMARY",
          "repetitions_observed": 3,
          "successes": 3,
          "success_rate": 1
        },
        {
          "scenario_type": "STRUCTURED_JSON_RESPONSE",
          "repetitions_observed": 3,
          "successes": 3,
          "success_rate": 1
        },
        {
          "scenario_type": "INFORMATION_LIMIT_RESPONSE",
          "repetitions_observed": 3,
          "successes": 3,
          "success_rate": 1
        },
        {
          "scenario_type": "NUMBER_DATE_FORMAT_RESPONSE",
          "repetitions_observed": 3,
          "successes": 3,
          "success_rate": 1
        },
        {
          "scenario_type": "SAFE_EDGE_CASE_INPUT",
          "repetitions_observed": 3,
          "successes": 3,
          "success_rate": 1
        }
      ],
      "schema_violation_count": 0,
      "tool_envelope_violation_count": 0,
      "malformed_count": 0,
      "unsupported_count": 0,
      "citation_violation_count": 0,
      "latency_ms": {
        "p50_ms": 3330,
        "p95_ms": 4714,
        "max_ms": 4714,
        "count": 15
      },
      "token_usage_aggregate": {
        "input_tokens_total": 1029,
        "output_tokens_total": 1047
      },
      "green": true
    },
    "RESPONSE_FORMAT": {
      "candidate_id": "RESPONSE_FORMAT",
      "construction_error": null,
      "requests_attempted": 15,
      "requests_succeeded": 0,
      "requests_failed": 15,
      "retries_performed": 0,
      "per_scenario": [
        {
          "scenario_type": "SHORT_KOREAN_FACT_SUMMARY",
          "repetitions_observed": 3,
          "successes": 0,
          "success_rate": 0
        },
        {
          "scenario_type": "STRUCTURED_JSON_RESPONSE",
          "repetitions_observed": 3,
          "successes": 0,
          "success_rate": 0
        },
        {
          "scenario_type": "INFORMATION_LIMIT_RESPONSE",
          "repetitions_observed": 3,
          "successes": 0,
          "success_rate": 0
        },
        {
          "scenario_type": "NUMBER_DATE_FORMAT_RESPONSE",
          "repetitions_observed": 3,
          "successes": 0,
          "success_rate": 0
        },
        {
          "scenario_type": "SAFE_EDGE_CASE_INPUT",
          "repetitions_observed": 3,
          "successes": 0,
          "success_rate": 0
        }
      ],
      "schema_violation_count": 0,
      "tool_envelope_violation_count": 0,
      "malformed_count": 0,
      "unsupported_count": 15,
      "citation_violation_count": 0,
      "latency_ms": {
        "p50_ms": 59,
        "p95_ms": 113,
        "max_ms": 113,
        "count": 15
      },
      "token_usage_aggregate": null,
      "green": false
    }
  },
  "selection": {
    "selected_candidate": "FUNCTION_CALLING",
    "status": "GREEN_SELECTED",
    "reason": "only NATIVE_V3_FUNCTION_CALLING reached 15/15 with zero malformed/schema/tool/envelope violations"
  },
  "security_attestation": {
    "checks": [
      {
        "check_name": "api_key_value_absent_from_report",
        "passed": true,
        "detail": "no API key was present this run to check for"
      },
      {
        "check_name": "authorization_header_absent_from_report",
        "passed": true,
        "detail": "scanned for an \"authorization\" JSON key or a \"Bearer <token>\" pattern"
      },
      {
        "check_name": "full_endpoint_url_absent_from_report",
        "passed": true,
        "detail": "the report records endpoint hostname classification only (config.redacted output), never the full endpoint_url"
      },
      {
        "check_name": "raw_prompt_text_absent_from_report",
        "passed": true,
        "detail": "scanned for the fixed scenario task texts (report records aggregate stats only)"
      },
      {
        "check_name": "raw_response_content_structurally_excluded",
        "passed": true,
        "detail": "the report is schema-validated against a fixed field list (additionalProperties:false) that has no room for a raw content/arguments/tool-call value -- see interfaces/hcx-structured-protocol-comparison-report.schema.json"
      }
    ],
    "overall_status": "PASS"
  }
}
